"City of Tacoma Solid Waste Facility - Tacoma","2018","Waste","Landfills","562212","Solid Waste Landfill","City of Tacoma","Tacoma","Pierce","Puget Sound Clean Air Agency","12,797","0","0","12,797","0","0","0","0","0",,"1","47.223413, -122.499775",,,"POINT (-122.499775 47.223413)"
"Tyson Fresh Meats, Inc. - Wallula","2014","Food Production","Meat Products","311611","Animal (except Poultry) Slaughtering","Tyson Foods, Inc","Wallula","Walla Walla","Ecology: Eastern Regional Office","77,161","0","21,368","55,781","12","0","0","0","0",,"2","46.137521, -118.913051",,,"POINT (-118.913051 46.137521)"
"Boise Cascade Wood Products, LLC.  Kettle Falls Plywood - Kettle Falls","2019","Wood Products","Other Wood Products","321219","Reconstituted Wood Product Manufacturing","Boise Cascade Company","Kettle Falls","Stevens","Ecology: Eastern Regional Office","73,603","56,367","16,466","116","654","0","0","0","0",,"2","48.613175, -118.116106",,,"POINT (-118.116106 48.613175)"
"Northwest Pipeline C/S - Sumas","2014","Natural Gas Systems","Natural Gas Transmission/Compression","486210","Pipeline Transportation of Natural Gas","The Williams Companies, Inc.","Sumas","Whatcom","Northwest Clean Air Agency","82,830","0","78,811","3,975","44","0","0","0","0",,"2","49.001, -122.2214",,,"POINT (-122.2214 49.001)"
"Air Liquide Hydrogen Plant  - Anacortes","2023","Petroleum Systems","Other Petroleum Systems","325120","Industrial Gas Manufacturing","Air Liquide USA Inc.","Anacortes","Skagit","Northwest Clean Air Agency","72,277","0","72,277","0","0","0","0","0","0",,"2","48.465617, -122.556032","72,277","Covered Entity","POINT (-122.556032 48.465617)"
"Grays Harbor Energy Center - Elma","2017","Power Plants","Natural Gas Turbine Plants","221112","Fossil Fuel Electric Power Generation","Invenergy Investment Company LLC","Elma","Grays Harbor","EFSEC","1,107,991","0","1,106,866","513","612","0","0","0","0",,"4","46.9688, -123.48",,,"POINT (-123.48 46.9688)"
"Keyes Fibre Corporation - Wenatchee","2023","Pulp and Paper","Other Pulp and Paper","322299","All Other Converted Paper Product Manufacturing","Tekni-Plex Wenatchee Fiber Consumer Porducts","Wenatchee","Chelan","Ecology: Central Regional Office","12,427","0","12,414","6","7","0","0","0","0",,"1","47.485987, -120.316363",,"Reporter","POINT (-120.316363 47.485987)"
"Okanogan County Central Landfill - Okanogan","2022","Waste","Landfills","562212","Solid Waste Landfill","Okanogan County","Okanogan","Okanogan","Ecology: Central Regional Office","17,014","0","0","17,014","0","0","0","0","0",,"1","48.341148, -119.620109",,,"POINT (-119.620109 48.341148)"
"Cowlitz County Headquarters Landfill - Castle Rock","2012","Waste","Landfills","562212","Solid Waste Landfill","Cowlitz County","Castle Rock","Cowlitz","Southwest Clean Air Agency","121,597","659","0","120,936","2","0","0","0","0",,"3","46.246902, -122.772284",,,"POINT (-122.772284 46.246902)"
"Alcoa Intalco Works - Ferndale","2021","Metals","Aluminum Production","331312","Primary Aluminum Production","Alcoa Corp.","Ferndale","Whatcom","Ecology: Industrial Section","9,411","0","1,188","8,222","1","0","0","0","0","Curtailed mid 2020.","1","48.8455, -122.7055",,,"POINT (-122.7055 48.8455)"
"Sonoco Products - Sumner","2016","Pulp and Paper","Other Pulp and Paper","322130","Paperboard Mills","Sonoco Products Company","Sumner","Pierce","Puget Sound Clean Air Agency","13,941","0","13,927","7","8","0","0","0","0",,"1","47.210641, -122.239474",,,"POINT (-122.239474 47.210641)"
"Lamb Weston - Warden","2016","Food Production","Potato Products","311411","Frozen Fruit, Juice, and Vegetable Manufacturing","Lamb Weston, Inc.","Warden","Grant","Ecology: Eastern Regional Office","18,099","0","18,081","9","10","0","0","0","0",,"1","46.971504, -119.055427",,,"POINT (-119.055427 46.971504)"
"DH Feeders - Eltopia","2012","Livestock","Cattle Feedlots","112112","Cattle Feedlots","Easterday Ranches","Eltopia","Franklin","Ecology: Eastern Regional Office","14,673","0","673","1,069","12,932","0","0","0","0",,"1","46.50919, -118.881203",,,"POINT (-118.881203 46.50919)"
"Puget Sound Energy LDC Facility - Bellevue","2021","Natural Gas Systems","Natural Gas Local Distribution Companies","221210","Natural Gas Distribution","Puget Holdings LLC","Bellevue","King","Puget Sound Clean Air Agency","64,596","0","1,327","63,268","1","0","0","0","0",,"2","47.61345, -122.19454",,,"POINT (-122.19454 47.61345)"
"Northwest Hardwoods Inc. - Centralia","2013","Wood Products","Lumber Mills","321113","Sawmills","Littlejohn & Co. LLC","Centralia","Lewis","Southwest Clean Air Agency","12,987","6,470","6,424","16","77","0","0","0","0",,"1","46.734454, -122.991963",,,"POINT (-122.991963 46.734454)"
"J.R. Simplot Company - Othello","2012","Food Production","Potato Products","311411","Frozen Fruit, Juice, and Vegetable Manufacturing","J.R. Simplot Company","Othello","Adams","Ecology: Eastern Regional Office","93,771","0","44,371","49,376","25","0","0","0","0",,"2","46.837778, -119.176389",,,"POINT (-119.176389 46.837778)"
"Darigold - Sunnyside","2015","Food Production","Dairy Products","311513","Cheese Manufacturing","Darigold Inc.","Sunnyside","Yakima","Yakima Regional Clean Air Agency","21,372","0","21,349","10","12","0","0","0","0",,"1","46.30058, -120.015675",,,"POINT (-120.015675 46.30058)"
"HF Sinclair Refining and Marketing LLC - Dallas","2023","Supplier","Other Fuel Supplier","324110","Petroleum Refineries","HF Sinclair Refining & Marketing LLC","Dallas","Dallas",,"3,467,175","128,378","3,302,142","3,116","33,539","0","0","0","0",,,,"3,124,379","Covered Entity",
"Lamb Weston - Connell","2021","Food Production","Potato Products","311411","Frozen Fruit, Juice, and Vegetable Manufacturing","Lamb Weston, Inc.","Connell","Franklin","Ecology: Eastern Regional Office","32,423","0","32,390","15","18","0","0","0","0",,"2","46.651389, -118.871944",,,"POINT (-118.871944 46.651389)"
"Boulder Park Generating Station - Spokane Valley","2020","Power Plants","Other Power, Heating, or Cooling Plants","221112","Fossil Fuel Electric Power Generation","Avista Corp.","Spokane Valley","Spokane","Spokane Regional Clean Air Agency","23,578","0","23,554","11","13","0","0","0","0",,"1","47.696999, -117.147223",,,"POINT (-117.147223 47.696999)"
"Lamb Weston - Warden","2017","Food Production","Potato Products","311411","Frozen Fruit, Juice, and Vegetable Manufacturing","Lamb Weston, Inc.","Warden","Grant","Ecology: Eastern Regional Office","18,987","0","18,968","9","11","0","0","0","0",,"1","46.971504, -119.055427",,,"POINT (-119.055427 46.971504)"
"Georgia-Pacific Gypsum LLC - Tacoma","2016","Manufacturing","Building Products","327420","Gypsum Product Manufacturing","Koch Industries Inc.","Tacoma","Pierce","Puget Sound Clean Air Agency","48,825","0","48,775","23","27","0","0","0","0",,"2","47.269558, -122.394869",,,"POINT (-122.394869 47.269558)"
"Avista Corporation - supplier","2021","Supplier","Natural Gas Supplier",,,"Avista Corporation","Spokane","Spokane",,"1,063,283","0","1,062,186","500","597","0","0","0","0",,,,,,
"Northwest Pipeline C/S - Chehalis","2015","Natural Gas Systems","Natural Gas Transmission/Compression","486210","Pipeline Transportation of Natural Gas","The Williams Companies, Inc.","Chehalis","Lewis","Southwest Clean Air Agency","29,670","0","28,001","1,653","16","0","0","0","0",,"2","46.533325, -122.87373",,,"POINT (-122.87373 46.533325)"
"J.R. Simplot Company - Moses Lake","2015","Food Production","Potato Products","311411","Frozen Fruit, Juice, and Vegetable Manufacturing","J.R. Simplot Company","Moses Lake","Grant","Ecology: Eastern Regional Office","34,886","3,790","26,871","4,197","29","0","0","0","0",,"2","47.131732, -119.18926",,,"POINT (-119.18926 47.131732)"
"Boulder Park Generating Station - Spokane Valley","2014","Power Plants","Other Power, Heating, or Cooling Plants","221112","Fossil Fuel Electric Power Generation","Avista Corp.","Spokane Valley","Spokane","Spokane Regional Clean Air Agency","7,552","0","7,544","4","4","0","0","0","0",,"1","47.696999, -117.147223",,,"POINT (-117.147223 47.696999)"
"Northwest Pipeline C/S - Sumner","2017","Natural Gas Systems","Natural Gas Transmission/Compression","486210","Pipeline Transportation of Natural Gas","The Williams Companies, Inc.","Sumner","Pierce","Puget Sound Clean Air Agency","37,486","0","36,678","787","21","0","0","0","0",,"2","47.228986, -122.209551",,,"POINT (-122.209551 47.228986)"
"Boise Cascade Wood Products, LLC.  Kettle Falls Lumber - Kettle Falls","2017","Wood Products","Lumber Mills","321912","Cut Stock, Resawing Lumber, and Planing","Boise Cascade Company","Kettle Falls","Stevens","Ecology: Eastern Regional Office","54,397","53,680","0","103","614","0","0","0","0",,"2","48.609799, -118.067441",,,"POINT (-118.067441 48.609799)"
"Lamb Weston - Richland","2012","Food Production","Potato Products","311411","Frozen Fruit, Juice, and Vegetable Manufacturing","Lamb Weston, Inc.","Richland","Benton","Benton Clean Air Agency","34,603","0","34,567","16","19","0","0","0","0",,"2","46.309314, -119.297267",,,"POINT (-119.297267 46.309314)"
"Musket Corporation - Houston","2023","Supplier","Other Fuel Supplier","457120","Other Gasoline Stations","Love s Travel Stop","Houston","Harris",,"77,075","58,224","18,732","16","103","0","0","0","0",,,,,"Reporter",
"WestRock LLC - Longview","2012","Pulp and Paper","Kraft Mills","322130","Paperboard Mills","Westrock Corp.","Longview","Cowlitz","Ecology: Industrial Section","1,672,199","1,451,139","187,079","11,879","22,103","0","0","0","0",,"4","46.10361, -122.92167",,,"POINT (-122.92167 46.10361)"
"Darigold - Lynden","2012","Food Production","Dairy Products","311514","Dry, Condensed, and Evaporated Dairy Product Manufacturing","Darigold Inc.","Lynden","Whatcom","Northwest Clean Air Agency","17,342","0","17,324","8","10","0","0","0","0",,"1","48.947567, -122.451915",,,"POINT (-122.451915 48.947567)"
"Greif, Tacoma Mill - Tacoma","2023","Pulp and Paper","Other Pulp and Paper","322130","Paperboard Mills","Paperboard Parent Inc.","Tacoma","Pierce","Puget Sound Clean Air Agency","13,060","0","13,047","6","7","0","0","0","0",,"1","47.239235, -122.421909",,"Reporter","POINT (-122.421909 47.239235)"
"Avista Corporation LDC - WA - statewide","2020","Natural Gas Systems","Natural Gas Local Distribution Companies","221210","Natural Gas Distribution","Avista Corp.","Spokane","Spokane","Spokane Regional Clean Air Agency","16,036","0","19","16,017","0","0","0","0","0",,"1","47.673662, -117.388735",,,"POINT (-117.388735 47.673662)"
"Simplot Feeders LTD. - Burbank","2017","Livestock","Cattle Feedlots","112112","Cattle Feedlots","J.R. Simplot Company","Burbank","Walla Walla","Ecology: Eastern Regional Office","28,791","0","0","2,077","26,714","0","0","0","0",,"2","46.133131, -118.90629",,,"POINT (-118.90629 46.133131)"
"Riverside Feeders SFL - Kennewick","2023","Livestock","Cattle Feedlots","112112","Cattle Feedlots","Easterday Ranches","Kennewick","Benton","Benton Clean Air Agency","17,203","0","612","1,288","15,302","0","0","0","0","Voluntary reporter.  Manure management reporting repealed by Legislature.","1","45.991872, -119.136497",,"Reporter","POINT (-119.136497 45.991872)"
"El Oro Cattle Feeders, LLC - Moses Lake","2016","Livestock","Cattle Feedlots","112112","Cattle Feedlots","Agri Beef Co.","Moses Lake","Grant","Ecology: Eastern Regional Office","23,506","0","0","1,821","21,685","0","0","0","0",,"1","47.052176, -119.093815",,,"POINT (-119.093815 47.052176)"
"Naval Base Kitsap Bangor - Silverdale","2013","Government","National Security","928110","National Security","US Government","Silverdale","Kitsap","Puget Sound Clean Air Agency","23,317","0","23,289","12","15","0","0","0","0",,"1","47.699284, -122.696926",,,"POINT (-122.696926 47.699284)"
"NW Natural - Portland","2014","Natural Gas Systems","Natural Gas Local Distribution Companies","221210","Natural Gas Distribution","NW Natural","Portland","Multnomah","Southwest Clean Air Agency","7,769","0","9","7,760","0","0","0","0","0",,"1","45.516631, -122.675749",,,"POINT (-122.675749 45.516631)"
"Weyerhaeuser Raymond Lumber - Raymond","2019","Wood Products","Lumber Mills","321113","Sawmills","Weyerhaeuser Co.","Raymond","Pacific","Olympic Region Clean Air Agency","39,695","39,172","0","75","448","0","0","0","0",,"2","46.688088, -123.737495",,,"POINT (-123.737495 46.688088)"
"Naval Base Kitsap - Bremerton","2022","Government","National Security","928110","National Security","US Government","Bremerton","Kitsap","Puget Sound Clean Air Agency","42,716","0","42,670","21","25","0","0","0","0",,"2","47.557047, -122.645933",,,"POINT (-122.645933 47.557047)"
"Puget Sound Energy - Encogen Generating Station - Bellingham","2012","Power Plants","Natural Gas Turbine Plants","221112","Fossil Fuel Electric Power Generation","Puget Holdings LLC","Bellingham","Whatcom","Northwest Clean Air Agency","51,680","0","51,627","24","29","0","0","0","0",,"2","48.746, -122.486",,,"POINT (-122.486 48.746)"
"Ed Staub & Sons Petroleum, Inc - Klamath","2023","Supplier","Other Fuel Supplier","424720","Petroleum and Petroleum Products Merchant Wholesalers (except Bulk Stations and Terminals)","Ed Staub & Sons Petroleum, Inc.","Klamath Falls","Klamath",,"18,751","1,171","17,331","21","228","0","0","0","0",,,,"14,586","Covered Entity",
"Hampton Lumber Mills Washington Inc. - Randle","2022","Wood Products","Lumber Mills","321113","Sawmills","Hampton Lumber Mills Washington Inc.","Randle","Lewis","Southwest Clean Air Agency","62,230","61,410","0","118","702","0","0","0","0",,"2","46.533743, -121.917906",,,"POINT (-121.917906 46.533743)"
"HF Sinclair Puget Sound Refinery LLC - Anacortes","2013","Petroleum Systems","Petroleum Refineries","324110","Petroleum Refineries","HollyFrontier Puget Sound Refining LLC","Anacortes","Skagit","Northwest Clean Air Agency","2,007,178","0","1,995,767","7,022","4,389","0","0","0","0","Assigned Emissions Level","5","48.470931, -122.559161",,,"POINT (-122.559161 48.470931)"
"Cardinal FG Company - Winlock","2021","Minerals","Glass Production","327211","Flat Glass Manufacturing","Cardinal Glass Industries Inc.","Winlock","Lewis","Southwest Clean Air Agency","105,912","0","105,838","34","40","0","0","0","0",,"3","46.544937, -122.926313",,,"POINT (-122.926313 46.544937)"
"McCain Foods - Othello","2020","Food Production","Potato Products","311411","Frozen Fruit, Juice, and Vegetable Manufacturing","McCain USA Inc.","Othello","Adams","Ecology: Eastern Regional Office","56,865","0","34,044","22,803","19","0","0","0","0",,"2","46.840102, -119.172705",,,"POINT (-119.172705 46.840102)"
"Puget Sound Energy - Ferndale Generating Station - Ferndale","2018","Power Plants","Natural Gas Turbine Plants","221112","Fossil Fuel Electric Power Generation","Puget Holdings LLC","Ferndale","Whatcom","Northwest Clean Air Agency","302,529","0","302,223","140","167","0","0","0","0",,"3","48.828707, -122.685533",,,"POINT (-122.685533 48.828707)"
"NW Natural - Portland","2013","Natural Gas Systems","Natural Gas Local Distribution Companies","221210","Natural Gas Distribution","NW Natural","Portland","Multnomah","Southwest Clean Air Agency","7,667","0","9","7,657","0","0","0","0","0",,"1","45.516631, -122.675749",,,"POINT (-122.675749 45.516631)"
"Ardagh Glass Inc. - Seattle","2023","Minerals","Glass Production","327213","Glass Container Manufacturing","Ardagh Holdings USA Inc.","Seattle","King","Puget Sound Clean Air Agency","44,364","0","44,329","16","19","0","0","0","0","Facility curtailed.","2","47.55242, -122.33739","44,364","Covered Entity","POINT (-122.33739 47.55242)"
"Air Liquide Electronics Moses Lake Hydrogen Plant","2022","Chemicals","Other Chemicals","325120","Industrial Gas Manufacturing","Air Liquide USA Inc.","Moses Lake","Grant","Ecology: Eastern Regional Office","0","0","0","0","0","0","0","0","0","Curtailed in May 2019.","1","47.135844, -119.19962",,,"POINT (-119.19962 47.135844)"
"Sierra Pacific Industries - Aberdeen","2022","Wood Products","Lumber Mills","321113","Sawmills","Sierra Pacific Industries","Aberdeen","Grays Harbor","Olympic Region Clean Air Agency","181,381","175,544","2,696","452","2,689","0","0","0","0",,"3","46.971875, -123.775526",,,"POINT (-123.775526 46.971875)"
"Washington Potato Company - Warden","2015","Food Production","Potato Products","311991","Perishable Prepared Food Manufacturing","Washington Potato Co.","Warden","Grant","Ecology: Eastern Regional Office","31,553","0","31,521","15","18","0","0","0","0",,"2","46.970469, -119.063631",,,"POINT (-119.063631 46.970469)"
"McCain Foods - Othello","2015","Food Production","Potato Products","311411","Frozen Fruit, Juice, and Vegetable Manufacturing","McCain USA Inc.","Othello","Adams","Ecology: Eastern Regional Office","77,566","0","38,078","39,467","21","0","0","0","0",,"2","46.840102, -119.172705",,,"POINT (-119.172705 46.840102)"
"Bonneville Power Administration - WA Only - statewide","2015","Power Plants","Electrical Transmission and Distribution","221121","Electric Bulk Power Transmission and Control","US Government","Vancouver","Clark","Southwest Clean Air Agency","14,245","0","0","0","0","0","0","14,245","0",,"1","45.661178, -122.658608",,,"POINT (-122.658608 45.661178)"
"Cowlitz County Headquarters Landfill - Castle Rock","2014","Waste","Landfills","562212","Solid Waste Landfill","Cowlitz County","Castle Rock","Cowlitz","Southwest Clean Air Agency","154,619","1,205","0","153,411","4","0","0","0","0",,"3","46.246902, -122.772284",,,"POINT (-122.772284 46.246902)"
"Horse Heaven Cattle Feeders, Inc. - Sunnyside","2015","Livestock","Cattle Feedlots","112112","Cattle Feedlots","Horse Heaven Cattle Feeders, Inc.","Sunnyside","Yakima","Yakima Regional Clean Air Agency","11,142","0","0","860","10,283","0","0","0","0",,"1","46.284622, -120.019668",,,"POINT (-120.019668 46.284622)"
"City of Ellensburg LDC - supplier","2021","Supplier","Natural Gas Supplier","221210","Natural Gas Distribution","City of Ellensburg","Ellensburg","Kittitas",,"27,613","0","27,585","13","15","0","0","0","0",,,,,,
"Northwest Pipeline C/S - Sumas","2013","Natural Gas Systems","Natural Gas Transmission/Compression","486210","Pipeline Transportation of Natural Gas","The Williams Companies, Inc.","Sumas","Whatcom","Northwest Clean Air Agency","76,727","0","71,662","5,025","40","0","0","0","0",,"2","49.001, -122.2214",,,"POINT (-122.2214 49.001)"
"U.S. Department of Energy Hanford Site - Richland","2013","Government","Other Government","924110","Administration of Air and Water Resource and Solid Waste Management Programs","US Government","Richland","Benton","Ecology: NWP","14,615","0","4,297","10,313","5","0","0","0","0",,"1","46.55069, -119.489007",,,"POINT (-119.489007 46.55069)"
"U.S. Oil & Refining Co. - Tacoma","2014","Petroleum Systems","Petroleum Refineries","324110","Petroleum Refineries","Par Pacific Holdings Inc.","Tacoma","Pierce","Puget Sound Clean Air Agency","179,363","0","176,926","1,857","580","0","0","0","0",,"3","47.256813, -122.394952",,,"POINT (-122.394952 47.256813)"
"Alcoa Intalco Works - Ferndale","2020","Metals","Aluminum Production","331312","Primary Aluminum Production","Alcoa Corp.","Ferndale","Whatcom","Ecology: Industrial Section","595,364","0","166,633","8,569","15","0","420,148","0","0","Curtailed mid 2020.  PFC emissions based on updated source test information.","3","48.8455, -122.7055",,,"POINT (-122.7055 48.8455)"
"Simplot Feeders LTD. - Burbank","2021","Livestock","Cattle Feedlots","112112","Cattle Feedlots","J.R. Simplot Company","Burbank","Walla Walla","Ecology: Eastern Regional Office","39,056","0","1,480","2,928","34,649","0","0","0","0","Voluntary reporter.  Manure management reporting repealed by Legislature.","2","46.133131, -118.90629",,,"POINT (-118.90629 46.133131)"
"SDS Lumber Company - Bingen","2023","Wood Products","Lumber Mills","321113","Sawmills","SDS Lumber Company","Bingen","Klickitat","Ecology: Central Regional Office","48,141","47,338","171","91","541","0","0","0","0",,"2","45.713913, -121.468688",,"Reporter","POINT (-121.468688 45.713913)"
"WestRock LLC - Longview","2017","Pulp and Paper","Kraft Mills","322130","Paperboard Mills","Westrock Corp.","Longview","Cowlitz","Ecology: Industrial Section","1,646,438","1,462,052","177,823","1,314","5,249","0","0","0","0",,"4","46.10361, -122.92167",,,"POINT (-122.92167 46.10361)"
"Frederickson Power LP - Tacoma","2016","Power Plants","Natural Gas Turbine Plants","221112","Fossil Fuel Electric Power Generation","Puget Sound Energy, Inc. and Capital Power (US Holdings) Inc","Tacoma","Pierce","Puget Sound Clean Air Agency","330,385","0","330,050","153","182","0","0","0","0",,"3","47.086342, -122.365686",,,"POINT (-122.365686 47.086342)"
"Graymont Western US. Inc. - Tacoma","2016","Minerals","Lime Production","327410","Lime Manufacturing","Graymont, Inc.","Tacoma","Pierce","Puget Sound Clean Air Agency","42,728","0","42,658","26","44","0","0","0","0",,"2","47.271365, -122.397262",,,"POINT (-122.397262 47.271365)"
"Lamb Weston - Richland","2013","Food Production","Potato Products","311411","Frozen Fruit, Juice, and Vegetable Manufacturing","Lamb Weston, Inc.","Richland","Benton","Benton Clean Air Agency","34,225","0","34,190","16","19","0","0","0","0",,"2","46.309314, -119.297267",,,"POINT (-119.297267 46.309314)"
"HF Sinclair Puget Sound Refinery LLC - Anacortes","2018","Petroleum Systems","Petroleum Refineries","324110","Petroleum Refineries","HollyFrontier Puget Sound Refining LLC","Anacortes","Skagit","Northwest Clean Air Agency","1,989,609","0","1,978,165","7,057","4,387","0","0","0","0","Assigned Emissions Level","4","48.470931, -122.559161",,,"POINT (-122.559161 48.470931)"
"REC Solar Grade Silicon - Moses Lake","2021","Metals","Other Metals","331410","Primary Smelting and Refining of Nonferrous Metal (except Copper and Aluminum)","REC Silicon","Moses Lake","Grant","Ecology: Eastern Regional Office","0","0","0","0","0","0","0","0","0","Curtailed in mid 2019. No emissions in 2021.","1","47.138359, -119.200383",,,"POINT (-119.200383 47.138359)"
"Waste Management Greater Wenatchee Regional Landfill - East Wenatchee","2019","Waste","Landfills","562212","Solid Waste Landfill","Waste Management Inc.","East Wenatchee","Douglas","Ecology: Central Regional Office","55,694","0","0","55,694","0","0","0","0","0",,"2","47.405083, -120.167444",,,"POINT (-120.167444 47.405083)"
"bp Cherry Point Refinery - Blaine","2022","Petroleum Systems","Petroleum Refineries","324110","Petroleum Refineries","BP America Inc.","Blaine","Whatcom","Northwest Clean Air Agency","2,123,672","0","2,112,799","6,485","4,388","0","0","0","0",,"5","48.8864, -122.7353",,,"POINT (-122.7353 48.8864)"
"Phillips 66 Ferndale Refinery - Ferndale","2015","Petroleum Systems","Petroleum Refineries","324110","Petroleum Refineries","Phillips 66 Company","Ferndale","Whatcom","Northwest Clean Air Agency","749,019","0","745,439","1,724","1,856","0","0","0","0",,"3","48.830142, -122.692114",,,"POINT (-122.692114 48.830142)"
"Cardinal FG Company - Winlock","2023","Minerals","Glass Production","327211","Flat Glass Manufacturing","Cardinal Glass Industries Inc.","Winlock","Lewis","Southwest Clean Air Agency","107,118","0","107,043","34","41","0","0","0","0",,"3","46.544937, -122.926313","107,118","Covered Entity","POINT (-122.926313 46.544937)"
"Great Western Malt - Vancouver","2020","Food Production","Other Food Products","311213","Malt Manufacturing","Great Western Malt","Vancouver","Clark","Southwest Clean Air Agency","15,286","0","15,270","7","9","0","0","0","0",,"1","45.631069, -122.690043",,,"POINT (-122.690043 45.631069)"
"Boise Cascade Wood Products, LLC.  Kettle Falls Lumber - Kettle Falls","2022","Wood Products","Lumber Mills","321912","Cut Stock, Resawing Lumber, and Planing","Boise Cascade Company","Kettle Falls","Stevens","Ecology: Eastern Regional Office","50,026","49,367","0","95","565","0","0","0","0",,"2","48.609799, -118.067441",,,"POINT (-118.067441 48.609799)"
"Georgia-Pacific Gypsum LLC - Tacoma","2017","Manufacturing","Building Products","327420","Gypsum Product Manufacturing","Koch Industries Inc.","Tacoma","Pierce","Puget Sound Clean Air Agency","46,857","0","46,808","22","26","0","0","0","0",,"2","47.269558, -122.394869",,,"POINT (-122.394869 47.269558)"
"Puget Sound Energy - Sumas Generating Station - Sumas","2016","Power Plants","Natural Gas Turbine Plants","221112","Fossil Fuel Electric Power Generation","Puget Holdings LLC","Sumas","Whatcom","Northwest Clean Air Agency","192,574","0","192,378","89","106","0","0","0","0",,"3","48.9905, -122.2733",,,"POINT (-122.2733 48.9905)"
"LANXESS Corporation - Kalama","2016","Chemicals","Other Chemicals","325199","All Other Basic Organic Chemical Manufacturing","Emerald Performance Materials LLC","Kalama","Cowlitz","Southwest Clean Air Agency","70,983","0","70,909","34","40","0","0","0","0",,"2","46.02191, -122.85698",,,"POINT (-122.85698 46.02191)"
"Horn Rapids Sanitary Landfill - Richland","2016","Waste","Landfills","562212","Solid Waste Landfill","City of Richland","Richland","Benton","Benton Clean Air Agency","26,021","0","0","26,021","0","0","0","0","0",,"2","46.346663, -119.348118",,,"POINT (-119.348118 46.346663)"
"Lamb Weston - Connell","2017","Food Production","Potato Products","311411","Frozen Fruit, Juice, and Vegetable Manufacturing","Lamb Weston, Inc.","Connell","Franklin","Ecology: Eastern Regional Office","35,862","0","35,825","17","20","0","0","0","0",,"2","46.651389, -118.871944",,,"POINT (-118.871944 46.651389)"
"Imerys Minerals Quincy Plant - Quincy","2023","Minerals","Other Minerals","212399","All Other Nonmetallic Mineral Mining","Imerys Filtration Minerals Inc.","Quincy","Grant","Ecology: Eastern Regional Office","15,599","0","15,583","7","9","0","0","0","0",,"1","47.239948, -119.838831",,"Reporter","POINT (-119.838831 47.239948)"
